Title,Price,Stock,Rating,Category
It's Only the Himalayas,£45.17,In stock,Two,Travel
Full Moon over Noah’s Ark: An Odyssey to Mount Ararat and Beyond,£49.43,In stock,Four,Travel
See America: A Celebration of Our National Parks & Treasured Sites,£48.87,In stock,Three,Travel
Vagabonding: An Uncommon Guide to the Art of Long-Term World Travel,£36.94,In stock,Two,Travel
Under the Tuscan Sun,£37.33,In stock,Three,Travel
A Summer In Europe,£44.34,In stock,Two,Travel
The Great Railway Bazaar,£30.54,In stock,One,Travel
A Year in Provence (Provence #1),£56.88,In stock,Four,Travel
The Road to Little Dribbling: Adventures of an American in Britain (Notes From a Small Island #2),£23.21,In stock,One,Travel
Neither Here nor There: Travels in Europe,£38.95,In stock,Three,Travel
"1,000 Places to See Before You Die",£26.08,In stock,Five,Travel
Sharp Objects,£47.82,In stock,Four,Mystery
"In a Dark, Dark Wood",£19.63,In stock,One,Mystery
The Past Never Ends,£56.50,In stock,Four,Mystery
A Murder in Time,£16.64,In stock,One,Mystery
The Murder of Roger Ackroyd (Hercule Poirot #4),£44.10,In stock,Four,Mystery
The Last Mile (Amos Decker #2),£54.21,In stock,Two,Mystery
That Darkness (Gardiner and Renner #1),£13.92,In stock,One,Mystery
Tastes Like Fear (DI Marnie Rome #3),£10.69,In stock,One,Mystery
A Time of Torment (Charlie Parker #14),£48.35,In stock,Five,Mystery
A Study in Scarlet (Sherlock Holmes #1),£16.73,In stock,Two,Mystery
Poisonous (Max Revere Novels #3),£26.80,In stock,Three,Mystery
Murder at the 42nd Street Library (Raymond Ambler #1),£54.36,In stock,Four,Mystery
Most Wanted,£35.28,In stock,Three,Mystery
Hide Away (Eve Duncan #20),£11.84,In stock,One,Mystery
Boar Island (Anna Pigeon #19),£59.48,In stock,Three,Mystery
The Widow,£27.26,In stock,Two,Mystery
Playing with Fire,£13.71,In stock,Three,Mystery
What Happened on Beale Street (Secrets of the South Mysteries #2),£25.37,In stock,Five,Mystery
The Bachelor Girl's Guide to Murder (Herringford and Watts Mysteries #1),£52.30,In stock,Five,Mystery
Delivering the Truth (Quaker Midwife Mystery #1),£20.89,In stock,Four,Mystery
Tipping the Velvet,£53.74,In stock,One,Historical Fiction
Forever and Forever: The Courtship of Henry Longfellow and Fanny Appleton,£29.69,In stock,Three,Historical Fiction
A Flight of Arrows (The Pathfinders #2),£55.53,In stock,Five,Historical Fiction
The House by the Lake,£36.95,In stock,One,Historical Fiction
Mrs. Houdini,£30.25,In stock,Five,Historical Fiction
The Marriage of Opposites,£28.08,In stock,Four,Historical Fiction
Glory over Everything: Beyond The Kitchen House,£45.84,In stock,Three,Historical Fiction
"Love, Lies and Spies",£20.55,In stock,Two,Historical Fiction
A Paris Apartment,£39.01,In stock,Four,Historical Fiction
Lilac Girls,£17.28,In stock,Two,Historical Fiction
The Constant Princess (The Tudor Court #1),£16.62,In stock,Three,Historical Fiction
The Invention of Wings,£37.34,In stock,One,Historical Fiction
World Without End (The Pillars of the Earth #2),£32.97,In stock,Four,Historical Fiction
The Passion of Dolssa,£28.32,In stock,Five,Historical Fiction
Girl With a Pearl Earring,£26.77,In stock,One,Historical Fiction
Voyager (Outlander #3),£21.07,In stock,Five,Historical Fiction
The Red Tent,£35.66,In stock,Five,Historical Fiction
The Last Painting of Sara de Vos,£55.55,In stock,Two,Historical Fiction
The Guernsey Literary and Potato Peel Pie Society,£49.53,In stock,One,Historical Fiction
Girl in the Blue Coat,£46.83,In stock,Two,Historical Fiction
Scott Pilgrim's Precious Little Life (Scott Pilgrim #1),£52.29,In stock,Five,Sequential Art
Tsubasa: WoRLD CHRoNiCLE 2 (Tsubasa WoRLD CHRoNiCLE #2),£16.28,In stock,One,Sequential Art
This One Summer,£19.49,In stock,Four,Sequential Art
The Nameless City (The Nameless City #1),£38.16,In stock,Four,Sequential Art
"Saga, Volume 5 (Saga (Collected Editions) #5)",£51.04,In stock,Two,Sequential Art
"Rat Queens, Vol. 3: Demons (Rat Queens (Collected Editions) #11-15)",£50.40,In stock,Three,Sequential Art
"Princess Jellyfish 2-in-1 Omnibus, Vol. 01 (Princess Jellyfish 2-in-1 Omnibus #1)",£13.61,In stock,Five,Sequential Art
"Pop Gun War, Volume 1: Gift",£18.97,In stock,One,Sequential Art
Patience,£10.16,In stock,Three,Sequential Art
"Outcast, Vol. 1: A Darkness Surrounds Him (Outcast #1)",£15.44,In stock,Four,Sequential Art
orange: The Complete Collection 1 (orange: The Complete Collection #1),£48.41,In stock,One,Sequential Art
"Lumberjanes, Vol. 2: Friendship to the Max (Lumberjanes #5-8)",£46.91,In stock,Two,Sequential Art
"Lumberjanes, Vol. 1: Beware the Kitten Holy (Lumberjanes #1-4)",£45.61,In stock,Three,Sequential Art
Lumberjanes Vol. 3: A Terrible Plan (Lumberjanes #9-12),£19.92,In stock,Two,Sequential Art
"I Hate Fairyland, Vol. 1: Madly Ever After (I Hate Fairyland (Compilations) #1-5)",£29.17,In stock,Two,Sequential Art
I am a Hero Omnibus Volume 1,£54.63,In stock,Three,Sequential Art
"Giant Days, Vol. 2 (Giant Days #5-8)",£22.11,In stock,Two,Sequential Art
Danganronpa Volume 1,£51.99,In stock,Four,Sequential Art
"Codename Baboushka, Volume 1: The Conclave of Death",£36.72,In stock,Four,Sequential Art
Camp Midnight,£17.08,In stock,Four,Sequential Art
